[
  {"id":5412,"l":"AMAZON","t":"Fone Bluetooth XYZ com ANC","pd":29990,"pp":19990,"c":"BESAVE10","dt":"2026-09-24T12:40:00Z","dp":"2026-10-06T15:02:00Z","a":"TECH","p":"UNISSEX"},
  {"id":5413,"l":"SHOPEE","t":"Kit Skincare Vitamina C 3 passos","pd":null,"pp":8990,"dt":"2026-09-24T12:41:00Z","dp":"2026-10-07T11:30:00Z","a":"ELAS","p":"FEMININO"},
  {"id":5420,"l":"MERCADO_LIVRE","t":"Ração Premium Cães Adultos 15kg","pd":24900,"pp":19900,"dt":"2026-09-23T08:00:00Z","dp":"2026-10-06T15:02:00Z","a":"PETS","p":"UNISSEX","x":1}
]
